video_id,title,channel_title,published_at,description
2czdDdVBNDw,Kiểm chứng đồ công nghệ team Vật Vờ Studio săn sale 12.12: Có thực sự hời?,Vật Vờ Studio,2026-02-01T13:14:39Z,Kiểm chứng đồ công nghệ team Vật Vờ Studio săn sale 12.12: Có thực sự hời? | Vật Vờ Studio ▻ SIM Data VV1 với 39K/tháng ...
cGPaJVBHzCk,Tư Vấn iPhone Cũ 2026: Đâu Là Những Máy Cần Tránh Và Đáng Mua Hơn?,Vật Vờ Studio,2026-01-31T12:15:30Z,Tư Vấn iPhone Cũ 2026: Đâu Là Những Máy Cần Tránh Và Đáng Mua Hơn? | Vật Vờ Studio ▻ SIM Data VV1 với 39K/tháng ...
Y_o-uZlxeBo,Tại Sao Samsung Không Còn Muốn Giữ Bí Mật Về Galaxy S26 Ultra Nữa?,Vật Vờ Studio,2026-01-29T12:41:09Z,Tại Sao Samsung Không Còn Muốn Giữ Bí Mật Về Galaxy S26 Ultra Nữa? | Vật Vờ Studio ▻ SIM Data VV1 với 39K/tháng - Gói ...
B9Gn-K8zQ2Q,Team Vật Vờ Studio Dùng Điện Thoại Gì Năm 2025?,Vật Vờ Studio,2026-01-13T05:06:06Z,Team Vật Vờ Studio Dùng Điện Thoại Gì Năm 2025? | Vật Vờ Studio ▻ SIM Data VV1 với 39K/tháng - Gói Cước Độc Quyền Của ...
sg9BbtW2JXg,Tư vấn điện thoại 12-15 triệu đầu 2026: Chính hãng hay xách tay thơm hơn?,Vật Vờ Studio,2026-01-14T11:40:36Z,Tư vấn điện thoại 12-15 triệu đầu 2026: Chính hãng hay xách tay thơm hơn? | Vật Vờ Studio ▻ Galaxy S25 FE chính hãng: ...
gov5oktbcFA,Tư vấn điện thoại 5 triệu: Nên chọn iPhone cũ hay máy Trung Quốc?,Vật Vờ Studio,2026-01-04T03:01:01Z,Tư vấn điện thoại 5 triệu: Nên chọn iPhone cũ hay máy Trung Quốc? Mua Meizu Lucky 08: https://s.shopee.vn/AKU2kIsnjs Mua ...
fVwv5vwf9u0,Tư vấn điện thoại 7-10 triệu: Phân khúc khó chọn nhất Việt Nam?,Vật Vờ Studio,2026-01-06T11:21:36Z,Tư vấn điện thoại 7-10 triệu: Phân khúc khó chọn nhất Việt Nam? | Vật Vờ Studio ▻ Mua Samsung Galaxy A56 5G: ...
XI77whmVoJg,Sự thật về iPhone đã qua sử dụng: Phải Zin tuyệt đối mới đáng mua?,Vật Vờ Studio,2025-12-03T11:41:47Z,Sự thật về iPhone đã qua sử dụng: Phải Zin tuyệt đối mới được mua? | Vật Vờ Studio ▻ SIM Data VV1 với 39K/tháng - Gói Cước ...
wKwjic7O8XE,"Tư Vấn 10 Tai Nghe Chơi Tết 2026: Từ 400k Đến 10 Triệu, Hãng Nào Cũng Có!",Vật Vờ Studio,2026-01-19T12:01:46Z,"Tư Vấn 10 Tai Nghe Chơi Tết 2026: Từ 400k Đến 10 Triệu, Hãng Nào Cũng Có! | Vật Vờ Studio ▻ Tham khảo các mẫu tai nghe ..."
j3PZmN9ZJXE,"Vì sao tới tháng 11 mà iPhone 17 thường vẫn cháy hàng, không có để mua?",Vật Vờ Studio,2025-11-15T04:38:42Z,"Vì sao tới tháng 11 mà iPhone 17 thường vẫn cháy hàng hơn cả Pro Max? | Vật Vờ Studio ▻ Hai tháng sau ngày ra mắt, iPhone ..."
X-mswtuGYrc,So sánh nhanh iPhone 17 Pro Max và Xiaomi 17 Ultra: Kèo căng tháng 3 về Việt Nam!,Vật Vờ Studio,2025-12-30T04:29:01Z,So sánh iPhone 17 Pro Max và Xiaomi 17 Ultra xách tay: Kèo căng sắp về chính hãng! | Vật Vờ Studio ▻ Nhận thông Xiaomi 17 ...
w70LeIjDd5g,Team Vật Vờ Studio đang dùng tai nghe gì? (Phần 1),Vật Vờ Studio,2025-11-30T09:28:18Z,Team Vật Vờ Studio đang dùng tai nghe gì? (Phần 1) | Vật Vờ Studio ▻ SIM Data VV1 với 39K/tháng - Gói Cước Độc Quyền Của ...
k7Hv0h1lRRo,"Sau 6 Năm, HUAWEI Trở Lại Bán Smartphones Ở Việt Nam 🇻🇳Có Máy Nào? Sẵn Google Không?",Vật Vờ Studio,2026-01-07T12:21:02Z,"Sau 6 Năm, HUAWEI Trở Lại Việt Nam Bán Smartphones | Vật Vờ Studio ▻ SIM Data VV1 với 39K/tháng - Gói Cước Độc Quyền ..."
t-yRA-pNjjM,Trên tay HUAWEI Mate X7 chính hãng: Phát súng đầu sau 7 năm tại Việt Nam 🇻🇳,Vật Vờ Studio,2026-01-16T11:41:55Z,Trên tay HUAWEI Mate X7 chính hãng: Phát súng đầu sau 7 năm tại Việt Nam | Vật Vờ Studio Sau một thời gian dài vắng ...
VcogNJGvzV0,"Tất Tần Tật Về Gemini Gems: AI Tự Động Hoá Của Google, Tiết Kiệm 69% Tốc Độ Làm Việc",Vật Vờ Studio,2026-01-17T12:09:33Z,"Tất Tần Tật Về Gemini Gems: AI Tự Động Hoá Của Google, Tiết Kiệm 69% Tốc Độ Làm Việc | Vật Vờ Studio ▻ SIM Data VV1 với ..."
bTg06gygK0Y,"So sánh pin flagship 9 hãng 2025: iPhone, Samsung, OPPO, vivo, Xiaomi, HONOR, OnePlus, iQOO, realme",Vật Vờ Studio,2025-11-06T05:12:46Z,"So sánh pin flagship 9 hãng 2025: iPhone, Samsung, OPPO, vivo, Xiaomi, HONOR, OnePlus, iQOO, realme | Vật Vờ Studio ..."
6QZ6x7HDrU8,Đây là dàn thiết bị quay phim của Vật Vờ Studio năm 2025,Vật Vờ Studio,2025-12-23T12:19:51Z,"Đây là dàn thiết bị quay phim của Vật Vờ Studio năm 2025 | Vật Vờ Studio Tham gia cuộc thi viết Góc Nhìn Dân Chơi, nhận điện ..."
Ca1K4LWXcz0,So sánh iPhone 17 - iPhone 16 - iPhone 15 - iPhone 14: Lên đời sao cho đáng giá?,Vật Vờ Studio,2025-12-17T11:36:45Z,So sánh iPhone 17 - iPhone 16 - iPhone 15 - iPhone 14: Lên đời sao cho đáng giá? | Vật Vờ Studio ▻ Mua iPhone chính hãng tại ...
Iq3UN5nUPhA,Vì Sao Nhiều Điện Thoại Sẽ Không Dùng Được App Ngân Hàng Từ 1/3/2026?,Vật Vờ Studio,2026-01-12T11:46:54Z,Vì Sao Nhiều Điện Thoại Sẽ Không Dùng Được App Ngân Hàng Từ 1/3/2026? | Vật Vờ Studio ▻ SIM Data VV1 với 39K/tháng ...
4W0TdThcQes,Mở hộp Xiaomi 17 Ultra by Leica đầu tiên tại Việt Nam và thử cơ chế xoay lens độc nhất,Vật Vờ Studio,2025-12-28T08:08:04Z,Mở hộp Xiaomi 17 Ultra by Leica đầu tiên tại Việt Nam và thử cơ chế xoay lens độc nhất | Vật Vờ Studio Tham gia cuộc thi viết ...
A7FrR7efBpM,Điện Thoại 5 - 10 - 15 - 30 Triệu Chụp Ảnh Khác Gì Nhau? (REDMI 15 vs Xiaomi 17 Ultra),Vật Vờ Studio,2026-01-24T04:58:39Z,Điện Thoại 5 - 10 - 15 - 30 Triệu Chụp Ảnh Khác Gì Nhau? (REDMI 15 vs Xiaomi 17 Ultra) | Vật Vờ Studio ▻ Mua Xiaomi 15T Pro ...
htiBe4MEQaQ,"Lý do team Vật Vờ Studio ngày càng thích Spotify, Apple Music mà không phải Zing MP3, NhacCuaTui",Vật Vờ Studio,2025-10-30T11:10:04Z,"Lý do team Vật Vờ Studio ngày càng thích Spotify, Apple Music mà không phải Zing MP3, NhacCuaTui | Vật Vờ Studio Chào anh ..."
uc4FxLNXDN0,Cảm nhận về HONOR Magic8 Pro QUỐC TẾ sau khi mua giá 24 TRIỆU: Phê hơn nội địa nhiều!,Vật Vờ Studio,2026-01-04T11:57:49Z,Cảm nhận về HONOR Magic8 Pro QUỐC TẾ sau khi mua giá 24 TRIỆU: Phê hơn nội địa nhiều! | Vật Vờ Studio Sau 2 tuần trải ...
RmCZxG1ky5A,20+ Món Đồ Xây Dựng Góc Làm Việc Trong Mơ Của Mình Năm 2026,Vật Vờ Studio,2026-01-16T04:30:36Z,"20+ Món Đồ Xây Dựng Góc Làm Việc Trong Mơ Của Mình Năm 2026 | Vật Vờ Studio ▻ Micro các loại chính hãng, giá rẻ, bảo ..."
4AdapvnV5kY,"Cảm nhận về OPPO Find X9 và Find X9 Pro sau 7 ngày: Giá 22 triệu và 32 triệu, chọn bản nào?",Vật Vờ Studio,2025-10-29T12:14:49Z,"Cảm nhận về OPPO Find X9 và Find X9 Pro sau 7 ngày: 22 triệu và 32 triệu, chọn bản nào? | Vật Vờ Studio Mua OPPO Find X9 ..."
