video_id,title,channel_title,published_at,description
jBjLLYvzi6c,TES vs T1 | CKTG 2025 - Bán Kết 2 Ngày 02.11.2025,LoL Esports VN,2025-11-02T10:27:15Z,Cùng theo dõi trận Bán Kết 2 của CKTG 2025 hôm nay nhé! ⚔️ TES vs T1 ▻ Đăng ký kênh để cập nhật các thông tin về Esports ...
8G1vC-hJjjc,KT vs T1 | CKTG 2025 - Chung Kết Ngày 09.11.2025,LoL Esports VN,2025-11-09T13:27:49Z,Cùng theo dõi trận Chung Kết của CKTG 2025 hôm nay nhé! ⚔️ KT vs T1 ▻ Đăng ký kênh để cập nhật các thông tin về Esports ...
jgtCTMpyUdw,Lu &amp; Mạnh bình luận T1 vs KT - Chung kết CKTG 2025 #worlds2025,Hoàng Luân,2025-11-09T13:07:19Z,Tham gia làm hội viên của kênh này để được hưởng đặc quyền: ...
7C2jU9cqCyc,CFO vs FLY | TES vs BLG | MKOI vs T1 | CKTG 2025 - Vòng Swiss Ngày 25.10.2025,LoL Esports VN,2025-10-25T12:51:27Z,Cùng theo dõi các trận của CKTG 2025 hôm nay nhé! ⚔️ CFO vs FLY ⚔️ TES vs BLG ⚔️ MKOI vs T1 ▻ Đăng ký kênh để ...
FEErMqy9oGo,AL vs T1 | CKTG 2025 - Tứ Kết 4 Ngày 31.10.2025,LoL Esports VN,2025-10-31T12:27:12Z,Cùng theo dõi trận Tứ Kết 1 của CKTG 2025 hôm nay nhé! ⚔️ AL vs T1 ▻ Đăng ký kênh để cập nhật các thông tin về Esports ...
IBYvWo-FfUc,Lu xem GEN vs KT (BO5) - CKTG #Worlds2025,Hoàng Luân,2025-11-01T12:42:52Z,Donate tại: WESCAN: https://qr.wescan.vn/HoangLuan https://playerduo.net/login/info/?userid=1182788 Paypal: ...
ZB2koGSQZ6Q,MKOI vs TSW | GEN vs TES | CKTG 2025 - Vòng Swiss Ngày 23.10.2025,LoL Esports VN,2025-10-23T12:58:24Z,Cùng theo dõi các trận của CKTG 2025 hôm nay nhé! ⚔️ MKOI vs TSW ⚔️ GEN vs TES ▻ Đăng ký kênh để cập nhật các ...
6NsvR0bzvv4,GEN vs HLE | CKTG 2025 - Tứ Kết 1 Ngày 28.10.2025,LoL Esports VN,2025-10-28T11:39:29Z,Cùng theo dõi trận Tứ Kết 1 của CKTG 2025 hôm nay nhé! ⚔️ GEN vs HLE ▻ Đăng ký kênh để cập nhật các thông tin về ...
Z4dee2GZgnI,GEN vs KT | CKTG 2025 - Bán Kết 1 Ngày 01.11.2025,LoL Esports VN,2025-11-01T11:40:35Z,Cùng theo dõi trận Bán Kết 1 của CKTG 2025 hôm nay nhé! ⚔️ GEN vs KT ▻ Đăng ký kênh để cập nhật các thông tin về ...
XflwtvgFLeQ,BLG vs VKS | 100T vs T1 | CKTG 2025 - Vòng Swiss Ngày 24.10.2025,LoL Esports VN,2025-10-24T12:44:18Z,Cùng theo dõi các trận của CKTG 2025 hôm nay nhé! ⚔️ BLG vs VKS ⚔️ 100T vs T1 ▻ Đăng ký kênh để cập nhật các thông ...
pGbAT7Xq5tw,HIGHLIGHTS | T1 vs KT | CKTG 2025 - Chung Kết,LoL Esports VN,2025-11-09T15:58:29Z,Đăng ký kênh để cập nhật các thông tin về Esports của LMHT một cách mới nhất: Youtube: ...
enw--2yY-3g,G2 vs TES | CKTG 2025 - Tứ Kết 3 Ngày 30.10.2025,LoL Esports VN,2025-10-30T11:12:02Z,Cùng theo dõi trận Tứ Kết 1 của CKTG 2025 hôm nay nhé! ⚔️ GEN vs HLE ▻ Đăng ký kênh để cập nhật các thông tin về ...
oHBLUYcmwpM,HLE vs CFO | G2 vs FLY | CKTG 2025 - Vòng Swiss Ngày 22.10.2025,LoL Esports VN,2025-10-22T13:46:45Z,Cùng theo dõi các trận của CKTG 2025 hôm nay nhé! ⚔️ HLE vs CFO ⚔️ G2 vs FLY ▻ Đăng ký kênh để cập nhật các thông ...
SYXdVvZnTzM,KT vs CFO | CKTG 2025 - Tứ Kết 2 Ngày 29.10.2025,LoL Esports VN,2025-10-29T09:59:28Z,Cùng theo dõi trận Tứ Kết 1 của CKTG 2025 hôm nay nhé! ⚔️ GEN vs HLE ▻ Đăng ký kênh để cập nhật các thông tin về ...
qdMXo_haBh0,T1 vs IG | CKTG 2025 - Vòng Play-ins Ngày 14.10.2025,LoL Esports VN,2025-10-14T13:51:40Z,Cùng theo dõi các trận của CKTG 2025 hôm nay nhé! ▻ Đăng ký kênh để cập nhật các thông tin về Esports của LMHT một cách ...
tF8nTlXTsRQ,BLG vs T1 (BO5) | CKTG 2024 - Chung Kết | 02.11.2024,LoL Esports VN,2024-11-02T19:18:58Z,Cùng theo dõi các trận của CKTG 2024 hôm nay nhé! ▻ Đăng ký kênh để cập nhật các thông tin về VCS một cách mới nhất: ...
DG8m2H3MsqQ,Mạnh ft a Lu xem GEN vs HLE (BO5)  - Worlds2025 #worlds2025,Đức Mạnh Melody,2025-11-01T03:49:32Z,AE có thể ủng hộ mình qua đây nhé: Vào Wescan: https://wescan.vn/Melody để donate và giao lưu trực tiếp nè Zypage: ...
DYiTowAbm-Q,Lu xem TSW vs MKOI | GEN vs TES #Worlds2025,Hoàng Luân,2025-10-23T13:16:53Z,Donate tại: WESCAN: https://qr.wescan.vn/HoangLuan https://playerduo.net/hoangluan Paypal: ...
KPglWuylWoM,Lu cổ vũ CFO vs KT (BO5) - CKTG #Worlds2025,Hoàng Luân,2025-10-29T09:47:45Z,Donate tại: WESCAN: https://qr.wescan.vn/HoangLuan https://playerduo.net/hoangluan Paypal: ...
dd22Eh_d57Y,Lu xem G2 vs TES (BO5) - CKTG #Worlds2025,Hoàng Luân,2025-10-31T15:11:55Z,Donate tại: WESCAN: https://qr.wescan.vn/HoangLuan https://playerduo.net/hoangluan Paypal: ...
n0To64KdRCQ,HIGHLIGHTS | T1 vs TES | CKTG 2025 - Bán Kết 2,LoL Esports VN,2025-11-02T12:47:08Z,Đăng ký kênh để cập nhật các thông tin về Esports của LMHT một cách mới nhất: Youtube: ...
Gt_Y6fXc1ac,T1 vs KT | Ván 5 | CKTG 2025 - Chung Kết,LoL Esports VN,2025-11-09T15:50:54Z,Đăng ký kênh để cập nhật các thông tin về Esports của LMHT một cách mới nhất: Youtube: ...
mxy2bR0WBnM,Ngày 1 | CKTG 2025 - Vòng Swiss Ngày 15.10.2025,LoL Esports VN,2025-10-15T13:55:13Z,Cùng theo dõi các trận của CKTG 2025 hôm nay nhé! Trận 1: VKS vs TSW Trận 2: CFO vs FNC Trận 3: MKOI vs KT Trận 4: BLG ...
WsbRcWp0mhc,KT vs TES | CFO vs AL | CKTG 2025 - Vòng Swiss Ngày 17.10.2025,LoL Esports VN,2025-10-17T13:22:43Z,Cùng theo dõi các trận của CKTG 2025 hôm nay nhé! Trận 1: KT vs TES Trận 2: CFO vs AL ▻ Đăng ký kênh để cập nhật các ...
UuRivq6n2rk,Lu xem T1 vs AL (BO5) - CKTG #Worlds2025,Hoàng Luân,2025-10-31T13:30:38Z,Donate tại: WESCAN: https://qr.wescan.vn/HoangLuan https://playerduo.net/hoangluan Paypal: ...
_0tJenFMhyg,MKOI vs T1 | Ván 1 | CKTG 2025 - Vòng Swiss,LoL Esports VN,2025-10-25T14:03:29Z,Đăng ký kênh để cập nhật các thông tin về Esports của LMHT một cách mới nhất: Youtube: ...
rpQ2CzHvvmE,TSW vs FLY | GEN vs T1 | G2 vs BLG | 100T vs HLE | CKTG 2025 - Vòng Swiss Ngày 18.10.2025,LoL Esports VN,2025-10-18T13:00:14Z,Cùng theo dõi các trận của CKTG 2025 hôm nay nhé! ⚔️ TSW vs ĐKVĐ LTA - FLY ⚔️ ĐKVĐ CKTG - T1 vs ĐKVĐ MSI - GEN ...
U37Ch4ogv8A,Lu xem GEN vs PSG #Worlds2025,Hoàng Luân,2025-10-15T15:14:43Z,Trận 1: VKS vs TSW Trận 2: CFO vs FNC Trận 3: MKOI vs KT Trận 4: BLG vs 100T Trận 5: FLY vs T1 Trận 6: HLE vs AL Trận 7: G2 ...
-K6_MEly-8s,XEM GIẢI CKTG TFT 15 NGÀY 2 : LẤY 8 NGƯỜI VÀO CHUNG KẾT,Em Chè ĐTCL,2025-11-15T14:44:28Z,"Lịch live cố định : 12 giờ trưa trừ Thứ 7, Chủ nhật Lịch đăng video : 21 giờ DONATE: Zypage : https://zypage.com/emche ..."
ljnpf50vp1g,Lu xem T1 vs TES (BO5) - CKTG #Worlds2025,Hoàng Luân,2025-11-03T17:16:52Z,Donate tại: WESCAN: https://qr.wescan.vn/HoangLuan https://playerduo.net/login/info/?userid=1182788 Paypal: ...
ZHpCXIBnWUc,Tứ kết CKTG CFO vs KT | Levi ft Văn Tùng (Bo5) #Worlds2025,Levi,2025-10-29T10:46:02Z,Lịch stream : 1h chiều mỗi ngày 0:00 Bắt đầu 1:05:05 CFO vs KT Game 1 2:01:01 Game 2 2:42:19 Game 3 3:26:15 Aram hỗn loạn ...
ty_-V8l-Jq8,Tứ kết CKTG GEN vs HLE (Bo5) Levi ft Văn Tùng #Worlds2025,Levi,2025-10-28T11:56:55Z,Lịch stream : 1h chiều mỗi ngày ----------------------------------------------------- Tham gia làm hội viên của Levi: ...
PyEhsSYBkhY,HIGHLIGHTS | GEN vs KT | CKTG 2025 - Bán Kết 1,LoL Esports VN,2025-11-01T13:11:38Z,Đăng ký kênh để cập nhật các thông tin về Esports của LMHT một cách mới nhất: Youtube: ...
SJzYVe11GPM,TÓM TẮT LỊCH SỬ 12 KỲ CKTG TRONG 60 PHÚT | BLV HOÀNG LUÂN,Hoàng Luân,2023-10-01T05:00:10Z,TÓM TẮT LỊCH SỬ 12 KỲ CKTG TRONG 60 PHÚT | BLV HOÀNG LUÂN #Lu #HoangLuan #CKTG 0:00: Phần giới thiệu 01:40: ...
GOi9mM-DjZo,HLE vs PSG | CKTG 2025 - Vòng Swiss Ngày 16.10.2025,LoL Esports VN,2025-10-16T13:22:00Z,Cùng theo dõi các trận của CKTG 2025 hôm nay nhé! Trận 1: FLY vs VKS Trận 2: TSW vs KT Trận 3: G2 vs MKOI Trận 4: TES vs ...
efrUSB3uiy4,HIGHLIGHTS | KT vs T1 | WORLDS 2025 | Chung kết | Hoàng Luân Co-stream,Hoàng Luân,2025-11-09T12:49:39Z,HIGHLIGHTS | KT vs T1 | WORLDS 2025 | Chung kết | Hoàng Luân Co-stream Tham gia làm hội viên của kênh này để được ...
IilIjImDN7g,Lu xem HLE vs PSG #Worlds2025 #CKTG,Hoàng Luân,2025-10-16T14:47:08Z,Donate tại: WESCAN: https://qr.wescan.vn/HoangLuan https://playerduo.net/hoangluan Paypal: ...
N1Pw7KRDIl0,T1 vs KT | Ván 4 | CKTG 2025 - Chung Kết,LoL Esports VN,2025-11-09T15:50:16Z,Đăng ký kênh để cập nhật các thông tin về Esports của LMHT một cách mới nhất: Youtube: ...
LWZzROksovI,FNC vs MKOI | VKS vs PSG | CKTG 2025 - Vòng Swiss Ngày 19.10.2025,LoL Esports VN,2025-10-19T13:49:03Z,Cùng theo dõi các trận của CKTG 2025 hôm nay nhé! ⚔️ FNC vs MKOI ⚔️ VKS vs PSG ▻ Đăng ký kênh để cập nhật các ...
ZcNH6F-o_t4,HIGHLIGHTS | GEN vs HLE | CKTG 2025 - Tứ Kết 1,LoL Esports VN,2025-10-28T13:02:39Z,Đăng ký kênh để cập nhật các thông tin về Esports của LMHT một cách mới nhất: Youtube: ...
7R7jXcJhyD0,Tứ kết CKTG T1 vs AL (Bo5) | Levi ft Văn Tùng #Worlds2025,Levi,2025-10-31T12:11:57Z,Lịch stream : 1h chiều mỗi ngày 0:00 Bắt đầu 5:00 Võ Đài ft Boongminz 1:07:07 T1 vs AL Ván 1 2:02:02 Ván 2 2:54:54 Ván 3 ...
W1xo3Ys9NJQ,🔴 NGÀY 2 - CHUNG KẾT THẾ GIỚI: VƯƠNG MIỆN CHIẾN THUẬT | TLN YBY1 | ĐTCL MÙA 15,Đấu Trường Chân Lý,2025-11-15T15:28:34Z,Chung Kết Thế Giới: Vương Miện Chiến Thuật – giải đấu cuối cùng của Đấu Trường Chân Lý Mùa 15! 40 cờ thủ xuất sắc nhất thế ...
jVEgdReei-A,100T vs T1 | Ván 1 | CKTG 2025 - Vòng Swiss,LoL Esports VN,2025-10-24T11:38:28Z,Đăng ký kênh để cập nhật các thông tin về Esports của LMHT một cách mới nhất: Youtube: ...
K2Mf3cW0axM,HIGHLIGHTS | T1 vs TES | WORLDS 2025 | Semifinals | Hoàng Luân Co-stream,Hoàng Luân,2025-11-02T10:08:51Z,HIGHLIGHTS | T1 vs TES | WORLDS 2025 | Semifinals | Hoàng Luân Co-stream Tham gia làm hội viên của kênh này để được ...
PSi27_trSKU,Levi ft Văn Tùng bình luận CKTG BLG vs VKS và T1 vs 100T #Worlds2025,Levi,2025-10-24T12:19:30Z,Lịch stream : 1h chiều mỗi ngày CKTG Ngày 9 vòng Swiss nhánh 1-2 15h bắt đầu Trận 1 : BLG vs VKS (Bo3) Trận 2 : 100T vs T1 ...
SmCmJpJlrZk,T1 VS AL | HIGHLIGHTS - TUYỆT ĐỐI ĐIỆN ẢNH CKTG 2025,Levi,2025-10-31T12:43:35Z,Lịch live stream : 1 giờ chiều mỗi ngày ------------------------------ Tham gia làm hội viên của Levi: ...
UL46krw73cc,HIGHLIGHTS | KT vs CFO | CKTG 2025 - Tứ Kết 2,LoL Esports VN,2025-10-29T11:47:13Z,Đăng ký kênh để cập nhật các thông tin về Esports của LMHT một cách mới nhất: Youtube: ...
d2Ms1cN5Uhg,CHECKMATE 20 ĐIỂM CKTG TFT MÙA 15 : CỔ VŨ YBY1 CĂNG NÀO,Em Chè ĐTCL,2025-11-16T14:58:39Z,"Lịch live cố định : 12 giờ trưa trừ Thứ 7, Chủ nhật Lịch đăng video : 21 giờ DONATE: Zypage : https://zypage.com/emche ..."
TDfyYvxeiaE,Văn Tùng ft. Levi bình luận CKTG: CFO vs FLY | TES vs BLG | T1 vs MKOI (BO3) #Worlds2025,Văn Tùng,2025-10-25T13:03:01Z,Chúc anh em xem live vui vẻ #worlds2025 Link xem trên Onlive: https://onlivetv.vn/ Discord hạm đội (có thể lấy link stream): ...
ADaZLxI3uWg,KT vs T1 | WORLDS 2025 | Finals,LoL Esports,2025-11-09T13:37:26Z,"EARN YOUR LEGACY. The 2025 League of Legends World Championship marks a historic milestone, the 15-year anniversary of ..."
